{
  "audio": {
    "tracks": [
      {
        "character": "keyumars",
        "duration_s": 5.15,
        "line_id": "s05_mourning_1",
        "path": "audio/s05_mourning_1/converted.wav",
        "start_frame": 13,
        "text_fa": "ای سیامک، دلخوشیِ پدر؛ جهان بی‌تو تاریک شد.",
        "trim_start_s": 0.48
      }
    ]
  },
  "beats": [
    {
      "from_frame": 1,
      "to_frame": 153,
      "what": "Keyumars mourns his son; the beasts grieve with him."
    }
  ],
  "camera": {
    "aim_point_m": [
      0.00917,
      0.87229,
      1.42407
    ],
    "aim_target": "keyumars.chest",
    "dof": true,
    "focal_mm": 110.462,
    "focus_distance_m": 8.0513,
    "move": {
      "ease": "in_out",
      "from_frame": 1,
      "from_position_m": [
        -0.01547,
        -7.13115,
        2.3
      ],
      "kind": "push_in",
      "to_frame": 153,
      "to_position_m": [
        -0.01142,
        -7.13115,
        2.15616
      ]
    },
    "ortho_scale": null,
    "orthographic": false,
    "position_m": [
      -0.01547,
      -7.13115,
      2.3
    ]
  },
  "cast": [
    {
      "assets": {
        "albedo": null,
        "body": "assets/characters/keyumars/rigged/rigged.blend",
        "face": null,
        "garments": [],
        "head_pose": "motion/s05_mourning__keyumars/head_pose.json",
        "motion": "motion/s05_mourning__keyumars/body.json",
        "rig": "assets/characters/keyumars/rigged/rigged.json",
        "shape": null,
        "visemes": [
          "audio/s05_mourning_1/visemes.json"
        ]
      },
      "character": "keyumars",
      "facing_deg": 180.0,
      "height_m": 1.95,
      "material_roles": {
        "surface": "skin"
      },
      "name_fa": "کیومرث",
      "offset_frames": 0,
      "position_m": [
        0.0,
        0.8,
        0.0
      ],
      "retime": "hold_last_pose",
      "rig_mode": "smplx"
    },
    {
      "assets": {
        "albedo": null,
        "body": "assets/characters/lion/rigged/rigged.blend",
        "face": null,
        "garments": [],
        "head_pose": "motion/s05_mourning__lion/head_pose.json",
        "motion": "motion/s05_mourning__lion/body.json",
        "rig": "assets/characters/lion/rigged/rigged.json",
        "shape": null,
        "visemes": []
      },
      "character": "lion",
      "facing_deg": 255.0,
      "height_m": 1.3,
      "material_roles": {
        "surface": "skin"
      },
      "name_fa": "شیر",
      "offset_frames": 0,
      "position_m": [
        -1.7,
        -1.0,
        0.0
      ],
      "retime": "hold_last_pose",
      "rig_mode": "rigged"
    },
    {
      "assets": {
        "albedo": null,
        "body": "assets/characters/gazelle/rigged/rigged.blend",
        "face": null,
        "garments": [],
        "head_pose": "motion/idle_quadruped/head_pose.json",
        "motion": "motion/idle_quadruped/body.json",
        "rig": "assets/characters/gazelle/rigged/rigged.json",
        "shape": null,
        "visemes": []
      },
      "character": "gazelle",
      "facing_deg": 105.0,
      "height_m": 0.9,
      "material_roles": {
        "surface": "skin"
      },
      "name_fa": "آهو",
      "offset_frames": 48,
      "position_m": [
        1.7,
        -1.0,
        0.0
      ],
      "retime": "loop",
      "rig_mode": "rigged"
    }
  ],
  "env": {
    "backdrop": "mourning_hollow_wide.png",
    "blend": "assets/envs/mourning_hollow/build/env.blend",
    "ground_role": "ground",
    "hdri": null,
    "id": "mourning_hollow",
    "interior": false,
    "light_intent": "cold pale dawn light, flat, no shadows",
    "props_json": null,
    "scatter": [],
    "strategy": "image_set"
  },
  "fps": 24,
  "frame_count": 153,
  "frame_end": 153,
  "frame_start": 1,
  "provenance": {
    "align": {
      "s05_mourning_1": {
        "approximate": true,
        "backend": "envelope",
        "speech_end_s": 5.63,
        "speech_start_s": 0.48
      }
    },
    "cast": {
      "gazelle": {
        "attach": {},
        "collection": "char_gazelle",
        "garments": [],
        "lines": [],
        "mesh": "gazelle",
        "offset_derived": true,
        "props": [],
        "rig": "gazelle_rig",
        "root_scale": 0.5625,
        "take": "idle_quadruped",
        "take_cycle_frames": 120,
        "take_reference_height_m": 1.6,
        "viseme_start_frame": {}
      },
      "keyumars": {
        "attach": {},
        "collection": "char_keyumars",
        "garments": [],
        "lines": [
          "s05_mourning_1"
        ],
        "mesh": "keyumars",
        "offset_derived": true,
        "props": [],
        "rig": "keyumars_rig",
        "root_scale": 1.14706,
        "take": "s05_mourning__keyumars",
        "take_cycle_frames": 336,
        "take_reference_height_m": 1.7,
        "viseme_start_frame": {
          "s05_mourning_1": 13
        }
      },
      "lion": {
        "attach": {},
        "collection": "char_lion",
        "garments": [],
        "lines": [],
        "mesh": "lion",
        "offset_derived": true,
        "props": [],
        "rig": "lion_rig",
        "root_scale": 0.8125,
        "take": "s05_mourning__lion",
        "take_cycle_frames": 318,
        "take_reference_height_m": 1.6,
        "viseme_start_frame": {}
      }
    },
    "env_collection": "env_mourning_hollow",
    "perspective_compression": 1.0,
    "props": {},
    "silence_lead_policy": "trim",
    "stage": "h_assemble",
    "viseme_profile": "smooth",
    "viseme_start_frame": {
      "s05_mourning_1": 13
    }
  },
  "resolution": [
    1920,
    1080
  ],
  "schema_version": 1,
  "shot_id": "s05_mourning",
  "style_pack": "stylized",
  "timing": {
    "duration_s": 6.35,
    "head_handle_s": 0.5,
    "min_duration_s": 0.0,
    "padded_s": 0.0,
    "source": "audio",
    "speech_end_s": 5.65,
    "speech_start_s": 0.5,
    "tail_handle_s": 0.7
  },
  "title": "s05_mourning"
}
